{
  "$schema": "../../schemas/map-radar.schema.json",
  "mapId": "default-map",
  "world": {
    "width": 256,
    "height": 256,
    "origin": {
      "x": 128,
      "y": 128
    }
  },
  "baseLayer": {
    "assetId": "default_map_base"
  },
  "palette": {
    "g": "#9bbf74",
    "d": "#8f7a5d",
    "c": "#74a6a6",
    "a": "#f0a64d",
    "w": "#e7d0a4",
    "s": "#7dffb1",
    "r": "#ff6b5f"
  },
  "symbols": {
    "crew": {
      "assetId": "symbol_crew"
    },
    "focus": {
      "assetId": "symbol_focus"
    }
  },
  "trace": {
    "layerNotice": "[TEMP DEV] 这些按钮只是临时调试开关，用来单独检查渲染层、256x256 功能坐标层和移动调试层。",
    "controlMode": "临时开发模式：渲染层、功能层与调试层已拆分显示。",
    "callMode": "本次从通话进入：地图交互仍需回到通话确认。",
    "worldLine": "[WORLD] 256 x 256 interactive coordinate grid",
    "jsonLine": "[JSON] radar glyph/tone/regions loaded from content/maps/radar/default-map-radar.json",
    "emptyLine": "[MAP] WAITING FOR 256x256 FIELD INPUT"
  },
  "regions": [
    {
      "id": "crash_site",
      "label": "坠毁初始落点",
      "priority": 100,
      "shape": {
        "type": "circle",
        "x": 128,
        "y": 128,
        "radius": 6
      },
      "tone": "s"
    },
    {
      "id": "scavenger_camp",
      "label": "拾荒营地",
      "priority": 80,
      "shape": {
        "type": "circle",
        "x": 132,
        "y": 120,
        "radius": 6
      },
      "tone": "a"
    },
    {
      "id": "frost_bay",
      "label": "霜湾聚落",
      "priority": 80,
      "shape": {
        "type": "circle",
        "x": 128,
        "y": 168,
        "radius": 8
      },
      "tone": "c"
    },
    {
      "id": "ember_fort",
      "label": "烬炉城寨",
      "priority": 80,
      "shape": {
        "type": "circle",
        "x": 128,
        "y": 88,
        "radius": 8
      },
      "tone": "a"
    },
    {
      "id": "gate_domain",
      "label": "门域",
      "priority": 50,
      "shape": {
        "type": "box",
        "x1": 140,
        "y1": 136,
        "x2": 188,
        "y2": 184
      },
      "tone": "r"
    },
    {
      "id": "ash_frost_belt",
      "label": "灰烬霜带",
      "priority": 20,
      "shape": {
        "type": "box",
        "x1": 96,
        "y1": 96,
        "x2": 160,
        "y2": 160
      },
      "tone": "g"
    }
  ],
  "renderLayers": [
    {
      "id": "buildings",
      "name": "建筑层",
      "visible": true,
      "items": [
        {
          "id": "iafs_crash_hull",
          "assetId": "iafs_crash_hull",
          "x": 122,
          "y": 126,
          "tone": "s"
        },
        {
          "id": "scavenger_tower",
          "assetId": "scavenger_tower",
          "x": 129,
          "y": 116,
          "tone": "a"
        },
        {
          "id": "frost_bay_dome",
          "assetId": "frost_bay_dome",
          "x": 122,
          "y": 164,
          "tone": "c"
        },
        {
          "id": "ember_fort",
          "assetId": "ember_fort",
          "x": 122,
          "y": 84,
          "tone": "a"
        }
      ]
    }
  ]
}
